{
  "schema_version": "1.3",
  "id": "redarc.web.acquisition-profile",
  "profile_status": "reviewed",
  "manufacturer": "REDARC",
  "publisher": "REDARC",
  "official_domains": ["www.redarc.com.au", "www.redarcelectronics.com"],
  "strategies": [
    {
      "id": "product-page-json-ld-script",
      "status": "reviewed",
      "reference_uri": "https://www.redarcelectronics.com/au/bcdc-alpha50-r",
      "path_prefix": "/au/",
      "embedded_json": {
        "representation": "embedded_json",
        "script": {
          "id": "product-schema",
          "media_type": "application/ld+json"
        },
        "json_path": "$.product",
        "record_collection_path": "$.offers",
        "identity_property": "sku"
      },
      "document_link_discovery": {
        "link_attribute": "href",
        "allowed_extensions": [".pdf"],
        "path_prefix": "/au/"
      }
    }
  ],
  "provenance": {
    "source_artifact": "docs/CORPUS_CAMPAIGN_WAVE_1.md",
    "observed_source_content_hash": "sha256:b3af1fa60fd5095ef1f71e9a0e3ee9fd41d47b9f6b0843e003f2c63b55555e78"
  },
  "html_fact_rules": [
    {
      "id": "exact-product-specification-table",
      "status": "reviewed",
      "path_prefix": "/us/",
      "identity_kind": "mpn",
      "identity_selector": [
        {
          "tag": "div",
          "attribute": {
            "name": "itemprop",
            "value": "sku"
          }
        }
      ],
      "regions": [
        {
          "kind": "table",
          "selector": [
            {
              "tag": "table",
              "id": "product-attribute-specs-table"
            }
          ]
        }
      ]
    }
  ]
}
